<?xml version="1.0" encoding="UTF-8"?>
<xs:schema xmlns:xs="http://www.w3.org/2001/XMLSchema">
    <xs:element name="global">
        <xs:complexType>
            <xs:sequence>
                <xs:element name="tabs" maxOccurs="unbounded" minOccurs="0">
                    <xs:complexType>
                        <xs:sequence>
                            <xs:element name="fields" maxOccurs="unbounded" minOccurs="0">
                                <xs:complexType>
                                    <xs:sequence>
                                        <xs:any processContents="lax" maxOccurs="unbounded" minOccurs="0"/>
                                    </xs:sequence>
                                    <xs:attribute type="xs:string" name="name" use="optional"/>
                                    <xs:attribute type="xs:string" name="type" use="optional"/>
                                    <xs:attribute type="xs:string" name="label" use="optional"/>
                                    <xs:attribute type="xs:string" name="required" use="optional"/>
                                </xs:complexType>
                            </xs:element>
                        </xs:sequence>
                        <xs:attribute type="xs:string" name="id" use="optional"/>
                        <xs:attribute type="xs:string" name="label" use="optional"/>
                        <xs:attribute type="xs:string" name="template" use="optional"/>
                    </xs:complexType>
                </xs:element>
            </xs:sequence>
        </xs:complexType>
    </xs:element>
</xs:schema>
